{
  "categories": {
    "slam-localization": "SLAM & Localization",
    "mapping-reconstruction": "Mapping & Reconstruction",
    "semantic-perception": "Semantic Perception",
    "navigation-planning": "Navigation & Planning",
    "manipulation-interaction": "Manipulation & Interaction",
    "dynamic-scenes": "Dynamic Scenes & Multi-Robot",
    "simulation-digital-twins": "Simulation & Digital Twins",
    "robot-learning-vla": "Robot Learning & VLA",
    "deployment-tooling": "Deployment & Tooling",
    "datasets-benchmarks": "Datasets & Benchmarks",
    "surveys-tutorials": "Surveys & Tutorials"
  },
  "kinds": [
    "system",
    "method",
    "library",
    "tool",
    "dataset",
    "benchmark",
    "simulator",
    "survey",
    "tutorial"
  ],
  "code_statuses": [
    "released",
    "partial",
    "paper-only",
    "archived",
    "unavailable"
  ],
  "inputs": [
    "monocular-rgb",
    "stereo-rgb",
    "multi-view-rgb",
    "rgb-d",
    "depth",
    "lidar",
    "point-cloud",
    "imu",
    "event-camera",
    "language",
    "robot-state",
    "simulation-state",
    "unknown"
  ],
  "pose_requirements": [
    "estimated-online",
    "external-poses",
    "known-poses",
    "optional",
    "not-applicable",
    "unknown"
  ],
  "frameworks": [
    "pytorch",
    "jax",
    "cuda",
    "ros",
    "ros2",
    "nerfstudio",
    "gsplat",
    "isaac-sim",
    "mujoco",
    "habitat",
    "omniverse",
    "unity",
    "open3d",
    "colmap",
    "custom",
    "unknown"
  ],
  "capabilities": [
    "camera-tracking",
    "pose-estimation",
    "dense-mapping",
    "reconstruction",
    "online",
    "loop-closure",
    "relocalization",
    "lidar-mapping",
    "semantics",
    "open-vocabulary",
    "instance-segmentation",
    "object-tracking",
    "planning",
    "navigation",
    "free-space",
    "collision-checking",
    "grasping",
    "manipulation",
    "affordance",
    "real-to-sim",
    "simulation",
    "policy-learning",
    "vla",
    "dynamic",
    "deformation",
    "multi-robot",
    "compression",
    "edge",
    "rendering",
    "scene-editing",
    "dataset",
    "benchmark"
  ],
  "tags": [
    "3dgs",
    "2dgs",
    "slam",
    "visual-odometry",
    "reconstruction",
    "open-vocabulary",
    "language",
    "semantics",
    "navigation",
    "path-planning",
    "mobile-robot",
    "manipulation",
    "grasping",
    "affordance",
    "real-to-sim",
    "sim-to-real",
    "robot-learning",
    "vla",
    "dynamic-scene",
    "multi-robot",
    "human-robot-interaction",
    "compression",
    "embedded",
    "benchmark",
    "dataset",
    "survey",
    "tooling"
  ]
}
